{
  "version": "1.2.0",
  "updated": "2026-07-22T17:56:16+08:00",
  "policy": {
    "mode": "studio-first",
    "curatedOnly": true,
    "autoEnableNewExtensions": false,
    "reviewStatuses": [
      "draft",
      "approved",
      "experimental",
      "deprecated",
      "rejected"
    ],
    "trustLevels": [
      "core",
      "curated",
      "experimental"
    ],
    "stateSources": [
      "default",
      "manual"
    ]
  },
  "extensions": [
    {
      "id": "extension-smoke",
      "version": "1.0.0",
      "title": "Extension Smoke",
      "sourcePath": "extensions/extension-smoke",
      "reviewStatus": "draft",
      "trustLevel": "experimental",
      "defaultEnabled": false,
      "owner": "studio",
      "approvedBy": null,
      "approvedAt": null,
      "contentSha256": "205795720b72ea3e8b4a40641e742578e5a27bc07a9f57a59637ab082666b991",
      "approvedContentSha256": null,
      "runtimeScopes": [
        "scripts",
        "docs"
      ],
      "capabilities": [
        "extension-lifecycle-smoke",
        "registry-validation"
      ],
      "notes": "Internal smoke extension for validating governance and runtime export."
    }
  ]
}
